{"format":"org.fieldnote.sighting","version":1,"id":"d72a11a9-4641-40f4-8b4c-5775379007c9","recordedAt":"2026-09-20T07:02:49.051Z","species":{"commonName":"Common Kingfisher","scientificName":"Alcedo atthis"},"observed":{"date":"2026-09-20","time":null,"utcOffset":null,"timezone":null,"precision":"day"},"place":{"name":"English wetland - illustrative site","latitude":52,"longitude":-1,"datum":"WGS84","uncertaintyMeters":50000,"source":"manual"},"observer":{"name":"Fieldnote Demo","identityAddress":"a0d176bfcd92f1e70c183da0a78504be4f2e2aa6"},"publisher":{"owner":"627a7fe06d1f9d93a0f4c7ed588e0d5b9eea80c9","appOrigin":"https://fieldnote-sightings-hrsh22.vercel.app"},"count":1,"notes":"Demonstration only. A synthetic sighting used to verify a sponsored Swarm upload and independent retrieval. The illustrative photo shows a Common Kingfisher in England, photographed by Tony Wood in 2012; it does not document this synthetic sighting.","photo":{"reference":"668c9b970f5473fdf425e976f4ea278987772ced47430728889cf0b39ddbad63","endpoint":"bytes","mediaType":"image/jpeg","bytes":1310793,"sha256":"45313a10ae72cf0f5afe73e25707618ec319854843362e15d541ccb38ca72c00","caption":"Common Kingfisher in England. Illustrative photograph by Tony Wood, 2012.","credit":"Tony Wood, CC BY 2.0 https://creativecommons.org/licenses/by/2.0/ | https://commons.wikimedia.org/wiki/File:Alcedo_atthis_-England-8.jpg | unchanged"},"demonstration":true}