{"format":"org.fieldnote.sighting","version":1,"id":"4ceb0158-ffc2-45b1-8760-53b97cdfa7a6","recordedAt":"2026-09-20T07:06:14.195Z","species":{"commonName":"Purple Sunbird","scientificName":"Cinnyris asiaticus"},"observed":{"date":"2026-09-20","time":"07:35","utcOffset":"+05:30","timezone":"Asia/Calcutta","precision":"minute"},"place":{"name":"Pashan Lake, Pune - illustrative site","latitude":18.5362,"longitude":73.7858,"datum":"WGS84","uncertaintyMeters":500,"source":"manual"},"observer":{"name":"Fieldnote Demo","identityAddress":"a0d176bfcd92f1e70c183da0a78504be4f2e2aa6"},"publisher":{"owner":"627a7fe06d1f9d93a0f4c7ed588e0d5b9eea80c9","appOrigin":"https://fieldnote-sightings-hrsh22.vercel.app"},"count":2,"notes":"Demonstration only. This synthetic timed sighting checks that a second save updates the same public notebook address, preserving the first record. Species, count, WGS84 coordinates, local time and UTC offset must remain readable in another app.","photo":null,"demonstration":true}